<?xml version="1.0" encoding="utf-8"?>
<xs:schema attributeFormDefault="unqualified" elementFormDefault="qualified" xmlns:xs="http://www.w3.org/2001/XMLSchema">
	<xs:element name="list">
		<xs:complexType mixed="true">
			<xs:sequence minOccurs="0">
				<xs:element maxOccurs="unbounded" name="zone">
					<xs:complexType>
						<xs:sequence>
							<xs:element minOccurs="0" maxOccurs="unbounded" name="stat">
								<xs:complexType>
									<xs:attribute name="name" type="xs:string" use="required" />
									<xs:attribute name="val" type="xs:string" use="required" />
								</xs:complexType>
							</xs:element>
							<xs:element maxOccurs="unbounded" name="node">
								<xs:complexType>
									<xs:attribute name="X" type="xs:int" use="required" />
									<xs:attribute name="Y" type="xs:int" use="required" />
								</xs:complexType>
							</xs:element>
							<xs:element minOccurs="0" maxOccurs="unbounded" name="spawn">
								<xs:complexType>
									<xs:attribute name="X" type="xs:int" use="required" />
									<xs:attribute name="Y" type="xs:int" use="required" />
									<xs:attribute name="Z" type="xs:short" use="required" />
									<xs:attribute name="isChaotic" type="xs:boolean" use="optional" />
								</xs:complexType>
							</xs:element>
						</xs:sequence>
						<xs:attribute name="type" type="xs:string" use="required" />
						<xs:attribute name="shape" type="xs:string" use="required" />
						<xs:attribute name="minZ" type="xs:short" use="required" />
						<xs:attribute name="maxZ" type="xs:short" use="required" />
						<xs:attribute name="id" type="xs:unsignedInt" use="optional" />
						<xs:attribute name="bossId" type="xs:short" use="optional" />
						<xs:attribute name="rad" type="xs:unsignedShort" use="optional" />
						<xs:attribute name="name" type="xs:string" use="optional" />
					</xs:complexType>
				</xs:element>
			</xs:sequence>
		</xs:complexType>
	</xs:element>
</xs:schema>