<?xml version="1.0" encoding="utf-8"?>
<list xmlns:xsi="http://www.w3.org/2001/XMLSchema-instance" xsi:noNamespaceSchemaLocation="../xsd/zones.xsd">
	<!-- Castle Zones -->
	<zone id="11200" type="CastleZone" shape="NPoly" minZ="-4448" maxZ="3551"> <!-- gludio_castle -->
		<stat name="castleId" val="1" />
		<node X="-22615" Y="104510" />
		<node X="-13290" Y="104564" />
		<node X="-13313" Y="116950" />
		<node X="-22638" Y="116896" />
		<!-- banish_point_list -->
		<spawn X="-15881" Y="110651" Z="-2770" isChaotic="true" />
		<spawn X="-15679" Y="110168" Z="-2770" isChaotic="true" />
		<spawn X="-15553" Y="110780" Z="-2770" isChaotic="true" />
		<spawn X="-15281" Y="110142" Z="-2770" isChaotic="true" />
		<!-- owner_restart_point_list -->
		<spawn X="-16554" Y="109382" Z="-1799" />
		<spawn X="-16869" Y="109375" Z="-1799" />
		<spawn X="-16659" Y="109261" Z="-1799" />
		<spawn X="-16618" Y="109485" Z="-1799" />
	</zone>
	<zone id="11201" type="CastleZone" shape="NPoly" minZ="-4642" maxZ="4000"> <!-- dion_castle -->
		<stat name="castleId" val="2" />
		<node X="26575" Y="165240" />
		<node X="17250" Y="165186" />
		<node X="17273" Y="152800" />
		<node X="26598" Y="152854" />
		<!-- banish_point_list -->
		<spawn X="19852" Y="159170" Z="-2770" isChaotic="true" />
		<spawn X="19650" Y="159653" Z="-2770" isChaotic="true" />
		<spawn X="19524" Y="159041" Z="-2770" isChaotic="true" />
		<spawn X="19252" Y="159679" Z="-2770" isChaotic="true" />
		<!-- owner_restart_point_list -->
		<spawn X="20514" Y="160368" Z="-1993" />
		<spawn X="20829" Y="160375" Z="-1993" />
		<spawn X="20619" Y="160489" Z="-1993" />
		<spawn X="20578" Y="160265" Z="-1993" />
	</zone>
	<zone id="11202" type="CastleZone" shape="NPoly" minZ="-4515" maxZ="19935"> <!-- giran_castle -->
		<stat name="castleId" val="3" />
		<node X="121412" Y="140594" />
		<node X="121358" Y="149919" />
		<node X="108972" Y="149896" />
		<node X="109026" Y="140571" />
		<!-- banish_point_list -->
		<spawn X="115275" Y="147273" Z="-2770" isChaotic="true" />
		<spawn X="115758" Y="147475" Z="-2770" isChaotic="true" />
		<spawn X="115146" Y="147601" Z="-2770" isChaotic="true" />
		<spawn X="115784" Y="147873" Z="-2770" isChaotic="true" />
		<!-- owner_restart_point_list -->
		<spawn X="116540" Y="146655" Z="-1866" />
		<spawn X="116547" Y="146340" Z="-1866" />
		<spawn X="116661" Y="146550" Z="-1866" />
		<spawn X="116437" Y="146591" Z="-1866" />
	</zone>
	<zone id="11203" type="CastleZone" shape="NPoly" minZ="-4242" maxZ="19935"> <!-- oren_castle -->
		<stat name="castleId" val="4" />
		<node X="87488" Y="32689" />
		<node X="87434" Y="42014" />
		<node X="75048" Y="41991" />
		<node X="75102" Y="32666" />
		<!-- banish_point_list -->
		<spawn X="81353" Y="39421" Z="-2770" isChaotic="true" />
		<spawn X="81836" Y="39623" Z="-2770" isChaotic="true" />
		<spawn X="81224" Y="39749" Z="-2770" isChaotic="true" />
		<spawn X="81862" Y="40021" Z="-2770" isChaotic="true" />
		<!-- owner_restart_point_list -->
		<spawn X="82616" Y="38750" Z="-1593" />
		<spawn X="82623" Y="38435" Z="-1593" />
		<spawn X="82737" Y="38645" Z="-1593" />
		<spawn X="82513" Y="38686" Z="-1593" />
	</zone>
	<zone id="11204" type="CastleZone" shape="NPoly" minZ="-3184" maxZ="6816"> <!-- aden_castle -->
		<stat name="castleId" val="5" />
		<node X="142431" Y="362" />
		<node X="152319" Y="344" />
		<node X="152282" Y="15197" />
		<node X="142393" Y="15215" />
		<!-- banish_point_list -->
		<spawn X="151765" Y="4175" Z="-592" isChaotic="true" />
		<spawn X="151555" Y="2660" Z="-592" isChaotic="true" />
		<spawn X="151065" Y="1813" Z="-592" isChaotic="true" />
		<spawn X="150952" Y="2615" Z="-592" isChaotic="true" />
		<!-- owner_restart_point_list -->
		<spawn X="147700" Y="4608" Z="-2784" />
		<spawn X="147705" Y="4865" Z="-2784" />
		<spawn X="147200" Y="4865" Z="-2784" />
		<spawn X="147200" Y="4350" Z="-2784" />
		<spawn X="147705" Y="4350" Z="-2784" />
	</zone>
	<zone id="11205" type="CastleZone" shape="NPoly" minZ="-2738" maxZ="4000"> <!-- innadrile_castle -->
		<stat name="castleId" val="6" />
		<node X="120526" Y="254019" />
		<node X="111201" Y="253965" />
		<node X="111224" Y="241579" />
		<node X="120549" Y="241633" />
		<!-- banish_point_list -->
		<spawn X="118730" Y="243416" Z="-1060" isChaotic="true" />
		<spawn X="118932" Y="242933" Z="-1060" isChaotic="true" />
		<spawn X="119058" Y="243545" Z="-1060" isChaotic="true" />
		<spawn X="119330" Y="242907" Z="-1060" isChaotic="true" />
		<!-- owner_restart_point_list -->
		<spawn X="114465" Y="249147" Z="-89" />
		<spawn X="114780" Y="249154" Z="-89" />
		<spawn X="114570" Y="249268" Z="-89" />
		<spawn X="114529" Y="249044" Z="-89" />
	</zone>
	<zone id="11206" type="CastleZone" shape="NPoly" minZ="-3397" maxZ="2103"> <!-- goddard_castle -->
		<stat name="castleId" val="7" />
		<node X="141457" Y="-51510" />
		<node X="151949" Y="-51510" />
		<node X="151949" Y="-39107" />
		<node X="145899" Y="-39107" />
		<node X="141457" Y="-44407" />
		<!-- banish_point_list -->
		<spawn X="154848" Y="-52608" Z="-2962" isChaotic="true" />
		<spawn X="156400" Y="-53808" Z="-2873" isChaotic="true" />
		<spawn X="138439" Y="-45153" Z="-2064" isChaotic="true" />
		<spawn X="140871" Y="-55380" Z="-3224" isChaotic="true" />
		<!-- owner_restart_point_list -->
		<spawn X="147408" Y="-46448" Z="-963" />
		<spawn X="147520" Y="-46432" Z="-963" />
		<spawn X="147408" Y="-46896" Z="-963" />
		<spawn X="147536" Y="-46896" Z="-963" />
	</zone>
	<zone id="11207" type="CastleZone" shape="Cuboid" minZ="-3000" maxZ="20000"> <!-- rune_castle -->
		<stat name="castleId" val="8" />
		<node X="7000" Y="-55500" />
		<node X="27250" Y="-41716" />
		<!-- banish_point_list -->
		<spawn X="38096" Y="-46976" Z="899" isChaotic="true" />
		<spawn X="38608" Y="-47168" Z="899" isChaotic="true" />
		<spawn X="38752" Y="-47792" Z="899" isChaotic="true" />
		<spawn X="38848" Y="-48640" Z="899" isChaotic="true" />
		<!-- owner_restart_point_list -->
		<spawn X="10891" Y="-49058" Z="3890" />
		<spawn X="11224" Y="-49116" Z="3890" />
		<spawn X="10974" Y="-49244" Z="3890" />
		<spawn X="10658" Y="-49211" Z="3890" />
	</zone>
	<zone id="11208" type="CastleZone" shape="Cuboid" minZ="-3800" maxZ="20000"> <!-- schuttgart_castle -->
		<stat name="castleId" val="9" />
		<node X="73000" Y="-156600" />
		<node X="82560" Y="-144750" />
		<!-- banish_point_list -->
		<spawn X="76131" Y="-145636" Z="-1200" isChaotic="true" />
		<spawn X="76298" Y="-145760" Z="-1184" isChaotic="true" />
		<spawn X="76319" Y="-145530" Z="-1208" isChaotic="true" />
		<spawn X="76104" Y="-145158" Z="-1264" isChaotic="true" />
		<!-- owner_restart_point_list -->
		<spawn X="77619" Y="-150591" Z="770" />
		<spawn X="77487" Y="-150735" Z="770" />
		<spawn X="77575" Y="-150992" Z="770" />
		<spawn X="77646" Y="-150441" Z="770" />
	</zone>
</list>