<?xml version="1.0" encoding="utf-8"?>
<list xmlns:xsi="http://www.w3.org/2001/XMLSchema-instance" xsi:noNamespaceSchemaLocation="../xsd/zones.xsd">
	<!-- Swamp Zones -->
	<zone type="SwampZone" shape="NPoly" minZ="-3964" maxZ="-3364"> <!-- devil_slow_8 -->
		<!-- stat name="initialDelay" val="1000" / -->
		<stat name="move_bonus" val="-80" />
		<node X="55250" Y="210873" />
		<node X="55762" Y="211217" />
		<node X="55934" Y="212274" />
		<node X="55686" Y="212533" />
		<node X="54639" Y="212740" />
		<node X="54276" Y="212407" />
		<node X="54160" Y="211696" />
		<node X="54332" Y="211108" />
	</zone>
	<!-- Sea of Spores (Swamp Zone) -->
	<zone type="SwampZone" shape="NPoly" minZ="-4468" maxZ="-4118"> <!-- spore_boss_swamp_zone -->
		<node X="43084" Y="15944" />
		<node X="45140" Y="15816" />
		<node X="45748" Y="17200" />
		<node X="44504" Y="18780" />
		<node X="43284" Y="18952" />
		<node X="42476" Y="18164" />
		<node X="42480" Y="16448" />
	</zone>
</list>